ICAC_Malla,Can data centre tenants be incentivized to reduce power consumption through real-time pricing mechanisms?,Simulation,Datacenter energy consumption,N/A,Positive ,Data Centers,,,Yes (algorithm defined with public workload traces),No,No,No,5,Public ,N,Yes,N/A,N,N,N/A
ICAC_Brataas,Which metrics provide an increased understanding of scalability within Cloud Software Services?,Real-world experiments,Cloud Scalability,N/A,Neutral,Cloud Computing ,Scalability,,"Partial (no code. However, datasets and underlying system /measurements used are detailed)",comparison of collected metrics for Openstack and Amazon Web service ,Yes,Yes,13,Public ,N,Yes,N/A,N,N,N/A
ICAC_Li,Can the analysis of app usage improve the quality of recovery decisions within smartphones?,Real-world experiments,Checkpointing (Smartphone applications),Level 4,Positive ,Smartphones,,,No (no code and explanations are too brief),"The proposed approach, MFU,MRU and Oracle",Yes,Yes,0,Private,N,Yes,Application state,N,N,Protocol
ICAC_Lalanda,Can the properties of Self-Awareness be applied to pervasive computing platforms?,Simulation,Self-Awareness for context management within Pervasive Computing,Level 4,Neutral,Pervasive Computing ,Self-Awareness,,Yes (code provided),Compared three use cases,No,No,7,Private,N,Yes,Behaviour (Components),N,N,DSL / Policy
ICAC_Pournaras,Can the orchestration of reverse computation across an agent-based model provide self-correction for decentralized networks?,Real-world experiments,Self-Correction within decentralized networks ,Level 4,Neutral,Decentralised networks,Self-healing,Self-correction,"Partial (algorithms provided, with all workloads/applications used referenced)",two scenarios (light and heavy network changes) comparison with related work,Yes,No,5,Public ,N,Yes,Node Topology,N,N,Multi-agent
ICAC_ Grohmann,Can the parameters for resource demand estimation methods be tailored to specific applications?,Real-world experiments,Parameter selection (resource demand estimation techniques),N/A,Positive ,Resource Demand Estimation,,,"Yes (code, algorithms and, workloads referenced)",Various scenarios,Yes,No,10,Public ,N,Yes,N/A,N,N,N/A
ICAC_Brocanelli,Which processes may be run at a lower priority to increase smartphone battery life?,Real-world experiments,Smartphones (energy usage),N/A,Positive ,Smartphones,energy usage ,,Yes (Clear methodology),three usage patterns and differing smartphones,Yes,Yes (multiple smartphone types),1,Public ,N,Yes,N/A,N,N,N/A
ICAC_Giridhar,Can event signals be correlated across multiple social media platforms for improved false positive elimination?,Simulation,Social media networks (event monitoring),N/A,Positive ,Event Monitoring,,,"Yes (algorithm provided, clear methodology on the collection of data)",two event detection techniques (Points of Interest and Instagram Event Localization),Yes,Yes,16,Synthetic/Private,N,Yes,N/A,N,N,N/A
ICAC_Vialon,Can the modification of quality constraints at runtime improve goal-based self-adaptation?,Theoretical discussion,Requirement/goal-based adaptation,Level 4,Neutral,Self-Adaptive Systems,,,N/A,No,No,No,4,N/A,N,Yes,Behavior (System goal),N,N,Protocol
ICAC_Frommgen,Can the adaption of the zookeeper consensus protocol increase the efficiency and throughput of zookeeper?,Real-world experiments,Improve the throughput of consensus protocol ,Level 4,Positive (mostly),Distributed frameworks,consensus protocols,, (algorithm defined and underlying framework referenced),No,Yes,No,2,Public,N,Yes,Consensus protocol,N,N,Protocol
ICAC_ Bencomo,What challenges arise due to uncertainty within operational environments and can models@run.time provide a solution?,Theoretical case-study,Self-Adaptive Systems,N/A,N/A,Self-Adaptation (Models @ runt.time),,,N/A,N/A,N/A,N/A,6,N/A,N,N/A,N/A,N,N,N/A
ICAC_Behara,Can autonomous object detection and depth perception techniques expand the capabilities of 3D depth perception?,Real-world experiments,Improve depth perception within 3d object detection,Level 4,Positive,Object Detection,,,Yes (approach is detailed with algorithms used referenced),No,Yes,No,0,Private,N,Yes,N/A,N,N,Protocol
ICAC_Tran,What are the computational requirements of virtualized baseband units?,Real-world experiments,Research Tool,N/A,Positive,Cloud Radio Access Networks (mobile cellular networks),,,Yes (Testbed is used to perform experiments),No,Yes,No,20,Private,N,Yes,N/A,N,N/A,N/A
ICAC_Velarde,What vulnerabilities exist within Distributed Model Predictive Control schemes?,Case-Study,Cyber - Security in autonomic control systems,N/A,Neutral,Cyber-Security,,,Yes (algorithms are provided and the exploited approach detailed),Various exploits,Yes,No,2,Synthetic,N,Yes,N/A,N,N/A,N/A
ICAC_Li/Niu,Can bandwidth-aware bath sizing and automatic routing of data streams reduce Spark streaming latency?,Real-world experiments,Streaming Applications (improving Latency),Level 4,Positive,Spark Streaming,,,"Yes (algorithms are explained, synthetic workloads are creatable and underlying framework is referenced)",Proposed approach and base implementation of spark streaming,Yes,Yes ,4,Synthetic,N,Yes,N/A,N,N,N/A
